wikipedia_actor,character_name,wikidata_actor,wikidata_film
/wiki/Mark_Wahlberg,Captain Leo DavidsonA virtuous astronaut who accidentally enters a portal to another world inhabited by talking humanoid apes and is captured by them. Leo leads a rebellion of the planet's humans. Wahlberg had backed out of a commitment to ,Q164119,Q469624
/wiki/Tim_Roth,General ThadeA sadistic chimpanzee military commander who wants control over the ape civilization. Thade also intends to marry Ari,Q203804,Q469624
/wiki/Helena_Bonham_Carter,AriA feisty,Q170428,Q469624
/wiki/Michael_Clarke_Duncan,Colonel AttarA gorilla military officer and Thade's former closest associate and second-in-command. Djimon Hounsou had turned down the role because of scheduling conflicts with The Four Feathers.[,Q483148,Q469624
/wiki/Estella_Warren,DaenaA female slave and Karubi's daughter,Q234472,Q469624
/wiki/Kris_Kristofferson,"KarubiDaena's father. Karubi is killed by Thade while trying to escape. Kristofferson had immediately agreed to be cast. ""The director Tim Burton is a hero of mine. I have eight kids and we've seen all of his films from ",Q208681,Q469624
/wiki/Cary-Hiroyuki_Tagawa,General KrullA firm but fair gorilla and former military leader whose career had been destroyed by Thade. Krull became a servant of Senator Sandar and assisted the humans in their rebellion.,Q381799,Q469624
/wiki/Paul_Giamatti,LimboA comical orangutan who works in the trade business of human slaves. Limbo is caught in the conflict between humans and apes and tries his best to simply survive. Giamatti drew inspiration from W. C. Fields for his performance. While his prosthetic makeup was being applied,Q208649,Q469624
