wikipedia_actor,character_name,wikidata_actor,wikidata_film
/wiki/Paul_Walker,Brian O'Conner:An LAPD officer sent to infiltrate a crew of hijackers. Mia's love interest.,Q213864,http://www.wikidata.org/entity/Q155476
/wiki/Vin_Diesel,Dominic Toretto:Leader of the heist crew and a professional street racer. He was banned from professional racing after a violent retaliatory attack on the man who accidentally killed Dominic's father.,Q178166,http://www.wikidata.org/entity/Q155476
/wiki/Michelle_Rodriguez,Letty Ortiz: A member of Dominic's crew and his girlfriend.,Q184219,http://www.wikidata.org/entity/Q155476
/wiki/Jordana_Brewster,Mia Toretto: Dominic's sister and owner of the Toretto general store. Brian's love interest.,Q230827,http://www.wikidata.org/entity/Q155476
/wiki/Rick_Yune,Johnny Tran: A Vietnamese gang leader and rival of Dominic.,Q923084,http://www.wikidata.org/entity/Q155476
/wiki/Chad_Lindberg,Jesse: A member of Dominic's crew. Highly intelligent with math,Q2314842,http://www.wikidata.org/entity/Q155476
/wiki/Johnny_Strong,Leon: A member of Dominic's crew,Q1702414,http://www.wikidata.org/entity/Q155476
/wiki/Matt_Schulze,Vince: A member of Dominic's crew and his childhood friend. He harbors an unrequited love for Mia.,Q538716,http://www.wikidata.org/entity/Q155476
